{
  "$schema": "https://json-schema.org/draft/2020-12/schema",
  "$id": "https://company-os.local/schemas/ai-process-contract.schema.json",
  "title": "Company OS AI Process Contract",
  "type": "object",
  "additionalProperties": false,
  "required": [
    "id",
    "name",
    "owner",
    "inputs",
    "expected_result",
    "allowed_actions",
    "forbidden_actions",
    "human_responsible",
    "cost_per_run",
    "benefit_metric",
    "auto_shutdown_condition",
    "user_opt_out"
  ],
  "properties": {
    "id": {"type": "string", "minLength": 1},
    "name": {"type": "string", "minLength": 1},
    "owner": {"type": "string", "minLength": 1},
    "inputs": {"type": "array", "items": {"type": "string"}, "minItems": 1},
    "expected_result": {"type": "string", "minLength": 1},
    "allowed_actions": {"type": "array", "items": {"type": "string"}, "minItems": 1},
    "forbidden_actions": {"type": "array", "items": {"type": "string"}, "minItems": 1},
    "human_responsible": {"type": "string", "minLength": 1},
    "cost_per_run": {
      "type": "object",
      "additionalProperties": false,
      "required": ["currency", "max_amount"],
      "properties": {
        "currency": {"type": "string", "default": "RUB"},
        "max_amount": {"type": "number", "minimum": 0}
      }
    },
    "benefit_metric": {
      "type": "object",
      "additionalProperties": false,
      "required": ["name", "target"],
      "properties": {
        "name": {"type": "string"},
        "target": {"type": ["number", "string"]},
        "measurement_window": {"type": "string"}
      }
    },
    "auto_shutdown_condition": {"type": "string", "minLength": 1},
    "user_opt_out": {
      "type": "object",
      "additionalProperties": false,
      "required": ["available", "method", "functions_retained", "data_processing_stops", "previous_data_policy", "service_impact"],
      "properties": {
        "available": {"type": "boolean"},
        "method": {"type": "string"},
        "functions_retained": {"type": "array", "items": {"type": "string"}},
        "data_processing_stops": {"type": "array", "items": {"type": "string"}},
        "previous_data_policy": {"type": "string"},
        "service_impact": {"type": "string"}
      }
    },
    "status": {
      "type": "string",
      "enum": ["draft", "contracted", "test", "production", "paused", "killed"],
      "default": "draft"
    }
  }
}
