{
  "id": "ai-mystery-shopper",
  "name": "AI Mystery Shopper",
  "owner": "Company OS",
  "inputs": [
    "approved customer journey scope",
    "website or landing page",
    "approved CRM and communications evidence",
    "test persona or simulation scenario"
  ],
  "expected_result": "Evidence-backed customer journey score, conversion leaks, prioritized fixes, and retest decision.",
  "allowed_actions": [
    "inspect public customer-facing pages",
    "run non-binding simulations",
    "analyze approved CRM timestamps and communications",
    "submit test leads only through explicitly approved test identities and channels",
    "score journey stages",
    "recommend fixes",
    "request retest"
  ],
  "forbidden_actions": [
    "make or authorize payment",
    "sign or accept a contract",
    "place a binding order or booking",
    "impersonate a real customer",
    "use real customer personal data for testing",
    "fabricate evidence",
    "contact real leads unless separately authorized",
    "delete production customer data"
  ],
  "human_responsible": "Business owner or designated commercial lead",
  "cost_per_run": {
    "currency": "RUB",
    "max_amount": 3000
  },
  "benefit_metric": {
    "name": "resolved_high_severity_conversion_leaks",
    "target": ">=1 per diagnostic cycle when high-severity leaks exist",
    "measurement_window": "per completed audit and retest cycle"
  },
  "auto_shutdown_condition": "Pause live execution after any unauthorized external commitment, personal-data breach, fabricated evidence, or three consecutive audits with no actionable finding and no measurable conversion improvement.",
  "user_opt_out": {
    "available": true,
    "method": "Disable AI Mystery Shopper for the project or channel in Company OS settings.",
    "functions_retained": [
      "manual sales audit",
      "manual CRM review",
      "manual customer journey testing"
    ],
    "data_processing_stops": [
      "AI analysis of journey evidence",
      "AI scoring of sales interactions",
      "AI generation of conversion recommendations"
    ],
    "previous_data_policy": "Previously generated audit artifacts remain according to the project retention policy unless separately deleted by an authorized human.",
    "service_impact": "Audits become manual, slower, less frequent, and less comparable across repeated test cycles."
  },
  "status": "contracted"
}
